{
  "schema": "cia-run/v1",
  "slot": "2026-10-01T08:30:00Z",
  "startedAt": "2026-10-01T08:30:01Z",
  "finishedAt": "2026-10-01T08:30:09Z",
  "prev": {
    "record": "data/v1/cia/runs/2026/10/01/0825Z.json",
    "sha256": "a0106f245b764a0da076a39bb0ac05a8b53258d61decd0022c3127ce7b3d9cc4"
  },
  "vantage": "scaleway:fr-par",
  "control": {
    "host": "connectivity.example",
    "ok": true,
    "httpStatus": 204,
    "latencyMs": 37
  },
  "incidents": {
    "source": "github",
    "commit": "d7361490a866534aea4f45266a111bef562f230e",
    "readAt": "2026-10-01T08:30:02Z",
    "snapshot": {
      "record": "data/v1/cia/incidents/2026/09/30/1815Z.json",
      "sha256": "a7995204ea8924ce72ef1e1be1b379de2bef4b065736372ef3869aff96379ddd"
    }
  },
  "services": {
    "frontend": {
      "url": "https://diagnos.example/",
      "availability": {
        "level": "ok",
        "checks": [
          {
            "id": "healthz",
            "level": "ok",
            "code": "ok",
            "attempts": 1,
            "httpStatus": 200,
            "latencyMs": 104,
            "tlsNotAfter": "2027-01-14T23:59:59Z",
            "timings": {
              "dnsMs": 2,
              "connectMs": 7,
              "tlsMs": 10,
              "firstByteMs": 41,
              "totalMs": 104
            },
            "error": null
          }
        ]
      },
      "integrity": {
        "level": "warn",
        "checks": [
          {
            "id": "release",
            "level": "warn",
            "code": "unsigned",
            "version": "1.0.28+client.0.42.1",
            "commit": "a2e9dd99023787ac9bf88ef0799577af26ad32ff",
            "digest": null,
            "verdict": null,
            "firstSeen": null,
            "served": null,
            "error": "The service runs a build without published evidence."
          }
        ]
      },
      "confidentiality": {
        "level": "ok",
        "checks": [
          {
            "id": "incidents",
            "level": "ok",
            "code": "clear",
            "open": [],
            "error": null
          }
        ]
      }
    },
    "sign": {
      "url": "https://sign.diagnos.example/",
      "availability": {
        "level": "ok",
        "checks": [
          {
            "id": "healthz",
            "level": "ok",
            "code": "ok",
            "attempts": 1,
            "httpStatus": 200,
            "latencyMs": 179,
            "tlsNotAfter": "2027-01-14T23:59:59Z",
            "timings": {
              "dnsMs": 10,
              "connectMs": 16,
              "tlsMs": 16,
              "firstByteMs": 84,
              "totalMs": 179
            },
            "error": null
          }
        ]
      },
      "integrity": {
        "level": "ok",
        "checks": [
          {
            "id": "release",
            "level": "ok",
            "code": "verified",
            "version": "0.1.18",
            "commit": "34664d7285e1737029c36870c7ec08b8245b0896",
            "digest": "b80c1555d6069162982b3074a5678b4d89c6da6827e44938ddf6c0e791824b5a",
            "verdict": "data/v1/cia/releases/sign/b80c1555d6069162982b3074a5678b4d89c6da6827e44938ddf6c0e791824b5a/verdict.json",
            "firstSeen": "2026-09-25T14:00:01Z",
            "served": {
              "checked": 4,
              "total": 4,
              "mismatches": 0,
              "lastCheckedAt": "2026-10-01T08:29:20Z"
            },
            "error": null
          }
        ]
      },
      "confidentiality": {
        "level": "warn",
        "checks": [
          {
            "id": "incidents",
            "level": "warn",
            "code": "incident-low",
            "open": [
              "2026-09-30-sign-session-ids-in-logs"
            ],
            "error": null
          }
        ]
      }
    },
    "status": {
      "url": "https://status.diagnos.example/",
      "availability": {
        "level": "ok",
        "checks": [
          {
            "id": "healthz",
            "level": "ok",
            "code": "ok",
            "attempts": 1,
            "httpStatus": 200,
            "latencyMs": 117,
            "tlsNotAfter": "2027-01-14T23:59:59Z",
            "timings": {
              "dnsMs": 3,
              "connectMs": 9,
              "tlsMs": 18,
              "firstByteMs": 72,
              "totalMs": 117
            },
            "error": null
          },
          {
            "id": "checkpoint:audit",
            "level": "ok",
            "code": "ok",
            "error": null
          },
          {
            "id": "checkpoint:signs",
            "level": "ok",
            "code": "ok",
            "error": null
          }
        ]
      },
      "integrity": {
        "level": "ok",
        "checks": [
          {
            "id": "release",
            "level": "ok",
            "code": "verified",
            "version": "0.2.0",
            "commit": "60f2d89fa340e91495526185cbcccd3ee3685939",
            "digest": "5ea026449bffc76780ddf304f61bdb793fb0e8494e061ec407abfccf1c41e5d8",
            "verdict": "data/v1/cia/releases/status/5ea026449bffc76780ddf304f61bdb793fb0e8494e061ec407abfccf1c41e5d8/verdict.json",
            "firstSeen": "2026-09-29T09:30:02Z",
            "served": {
              "checked": 10,
              "total": 10,
              "mismatches": 0,
              "lastCheckedAt": "2026-10-01T08:29:20Z"
            },
            "error": null
          },
          {
            "id": "log:audit",
            "level": "ok",
            "code": "ok",
            "status": "unchanged",
            "size": 187586,
            "record": "data/v1/audit/witness/2026/10/01/080505Z.json",
            "finding": null,
            "error": null
          },
          {
            "id": "log:signs",
            "level": "ok",
            "code": "ok",
            "status": "unchanged",
            "size": 9208,
            "record": "data/v1/signs/witness/2026/10/01/065504Z.json",
            "finding": null,
            "error": null
          }
        ]
      },
      "confidentiality": {
        "level": "ok",
        "checks": [
          {
            "id": "incidents",
            "level": "ok",
            "code": "clear",
            "open": [],
            "error": null
          }
        ]
      }
    },
    "vault": {
      "url": "https://vault.diagnos.example/",
      "availability": {
        "level": "ok",
        "checks": [
          {
            "id": "healthz",
            "level": "ok",
            "code": "ok",
            "attempts": 1,
            "httpStatus": 200,
            "latencyMs": 89,
            "tlsNotAfter": "2027-01-14T23:59:59Z",
            "timings": {
              "dnsMs": 1,
              "connectMs": 5,
              "tlsMs": 12,
              "firstByteMs": 50,
              "totalMs": 89
            },
            "error": null
          }
        ]
      },
      "integrity": {
        "level": "ok",
        "checks": [
          {
            "id": "release",
            "level": "ok",
            "code": "verified",
            "version": "0.1.29",
            "commit": "f57c3047a9217ba271c175538b06882bcc3cad16",
            "digest": "84bab68bc3b4efa42633698663052ada6227b26271c6348c83c514b993e965bd",
            "verdict": "data/v1/cia/releases/vault/84bab68bc3b4efa42633698663052ada6227b26271c6348c83c514b993e965bd/verdict.json",
            "firstSeen": "2026-09-28T16:20:01Z",
            "served": {
              "checked": 2,
              "total": 2,
              "mismatches": 0,
              "lastCheckedAt": "2026-10-01T08:29:20Z"
            },
            "error": null
          }
        ]
      },
      "confidentiality": {
        "level": "ok",
        "checks": [
          {
            "id": "incidents",
            "level": "ok",
            "code": "clear",
            "open": [],
            "error": null
          }
        ]
      }
    }
  }
}
