{
  "schema": "cia-run/v1",
  "slot": "2026-10-01T13:45:00Z",
  "startedAt": "2026-10-01T13:45:01Z",
  "finishedAt": "2026-10-01T13:45:06Z",
  "prev": {
    "record": "data/v1/cia/runs/2026/10/01/1340Z.json",
    "sha256": "af15feea4e1928e16ec1072d732ddfeece26f6c14d6935cd797f3402720ee1e2"
  },
  "vantage": "scaleway:fr-par",
  "control": {
    "host": "connectivity.example",
    "ok": true,
    "httpStatus": 204,
    "latencyMs": 37
  },
  "incidents": {
    "source": "github",
    "commit": "d7361490a866534aea4f45266a111bef562f230e",
    "readAt": "2026-10-01T13:45:02Z",
    "snapshot": {
      "record": "data/v1/cia/incidents/2026/10/01/1155Z.json",
      "sha256": "c78a5fdea4145a76c35155a32291d19c5fdb9abee5e74c555d68d8d9c6b7da2e"
    }
  },
  "services": {
    "frontend": {
      "url": "https://diagnos.example/",
      "availability": {
        "level": "ok",
        "checks": [
          {
            "id": "healthz",
            "level": "ok",
            "code": "ok",
            "attempts": 1,
            "httpStatus": 200,
            "latencyMs": 60,
            "tlsNotAfter": "2027-01-14T23:59:59Z",
            "timings": {
              "dnsMs": 3,
              "connectMs": 3,
              "tlsMs": 8,
              "firstByteMs": 33,
              "totalMs": 60
            },
            "error": null
          }
        ]
      },
      "integrity": {
        "level": "ok",
        "checks": [
          {
            "id": "release",
            "level": "ok",
            "code": "verified",
            "version": "1.0.29+client.0.42.2",
            "commit": "08cd92d8afef86359242ee60326cb84df2e78819",
            "digest": "6061b44ff22ba5f4ae7dbf3d8d3998b84e54797765cf47e08bfd1b82fa7a907a",
            "verdict": "data/v1/cia/releases/frontend/6061b44ff22ba5f4ae7dbf3d8d3998b84e54797765cf47e08bfd1b82fa7a907a/verdict.json",
            "firstSeen": "2026-10-01T10:00:01Z",
            "served": {
              "checked": 6,
              "total": 6,
              "mismatches": 0,
              "lastCheckedAt": "2026-10-01T13:44:20Z"
            },
            "error": null
          }
        ]
      },
      "confidentiality": {
        "level": "ok",
        "checks": [
          {
            "id": "incidents",
            "level": "ok",
            "code": "clear",
            "open": [],
            "error": null
          }
        ]
      }
    },
    "sign": {
      "url": "https://sign.diagnos.example/",
      "availability": {
        "level": "ok",
        "checks": [
          {
            "id": "healthz",
            "level": "ok",
            "code": "ok",
            "attempts": 1,
            "httpStatus": 200,
            "latencyMs": 186,
            "tlsNotAfter": "2027-01-14T23:59:59Z",
            "timings": {
              "dnsMs": 9,
              "connectMs": 11,
              "tlsMs": 22,
              "firstByteMs": 96,
              "totalMs": 186
            },
            "error": null
          }
        ]
      },
      "integrity": {
        "level": "ok",
        "checks": [
          {
            "id": "release",
            "level": "ok",
            "code": "verified",
            "version": "0.1.18",
            "commit": "34664d7285e1737029c36870c7ec08b8245b0896",
            "digest": "b80c1555d6069162982b3074a5678b4d89c6da6827e44938ddf6c0e791824b5a",
            "verdict": "data/v1/cia/releases/sign/b80c1555d6069162982b3074a5678b4d89c6da6827e44938ddf6c0e791824b5a/verdict.json",
            "firstSeen": "2026-09-25T14:00:01Z",
            "served": {
              "checked": 4,
              "total": 4,
              "mismatches": 0,
              "lastCheckedAt": "2026-10-01T13:44:20Z"
            },
            "error": null
          }
        ]
      },
      "confidentiality": {
        "level": "ok",
        "checks": [
          {
            "id": "incidents",
            "level": "ok",
            "code": "clear",
            "open": [],
            "error": null
          }
        ]
      }
    },
    "status": {
      "url": "https://status.diagnos.example/",
      "availability": {
        "level": "ok",
        "checks": [
          {
            "id": "healthz",
            "level": "ok",
            "code": "ok",
            "attempts": 1,
            "httpStatus": 200,
            "latencyMs": 105,
            "tlsNotAfter": "2027-01-14T23:59:59Z",
            "timings": {
              "dnsMs": 6,
              "connectMs": 10,
              "tlsMs": 11,
              "firstByteMs": 51,
              "totalMs": 105
            },
            "error": null
          },
          {
            "id": "checkpoint:audit",
            "level": "ok",
            "code": "ok",
            "error": null
          },
          {
            "id": "checkpoint:signs",
            "level": "ok",
            "code": "ok",
            "error": null
          }
        ]
      },
      "integrity": {
        "level": "fail",
        "checks": [
          {
            "id": "release",
            "level": "ok",
            "code": "verified",
            "version": "0.2.0",
            "commit": "60f2d89fa340e91495526185cbcccd3ee3685939",
            "digest": "5ea026449bffc76780ddf304f61bdb793fb0e8494e061ec407abfccf1c41e5d8",
            "verdict": "data/v1/cia/releases/status/5ea026449bffc76780ddf304f61bdb793fb0e8494e061ec407abfccf1c41e5d8/verdict.json",
            "firstSeen": "2026-09-29T09:30:02Z",
            "served": {
              "checked": 10,
              "total": 10,
              "mismatches": 0,
              "lastCheckedAt": "2026-10-01T13:44:20Z"
            },
            "error": null
          },
          {
            "id": "log:audit",
            "level": "ok",
            "code": "ok",
            "status": "witnessed",
            "size": 188649,
            "record": "data/v1/audit/witness/2026/10/01/134503Z.json",
            "finding": null,
            "error": null
          },
          {
            "id": "log:signs",
            "level": "fail",
            "code": "halted",
            "status": "halted",
            "size": 9236,
            "record": "data/v1/signs/witness/2026/10/01/132005Z.json",
            "finding": "data/v1/signs/findings/2026/10/01/133507Z.json",
            "error": null
          }
        ]
      },
      "confidentiality": {
        "level": "ok",
        "checks": [
          {
            "id": "incidents",
            "level": "ok",
            "code": "clear",
            "open": [],
            "error": null
          }
        ]
      }
    },
    "vault": {
      "url": "https://vault.diagnos.example/",
      "availability": {
        "level": "ok",
        "checks": [
          {
            "id": "healthz",
            "level": "ok",
            "code": "ok",
            "attempts": 1,
            "httpStatus": 200,
            "latencyMs": 81,
            "tlsNotAfter": "2027-01-14T23:59:59Z",
            "timings": {
              "dnsMs": 1,
              "connectMs": 6,
              "tlsMs": 8,
              "firstByteMs": 35,
              "totalMs": 81
            },
            "error": null
          }
        ]
      },
      "integrity": {
        "level": "ok",
        "checks": [
          {
            "id": "release",
            "level": "ok",
            "code": "verified",
            "version": "0.1.29",
            "commit": "f57c3047a9217ba271c175538b06882bcc3cad16",
            "digest": "84bab68bc3b4efa42633698663052ada6227b26271c6348c83c514b993e965bd",
            "verdict": "data/v1/cia/releases/vault/84bab68bc3b4efa42633698663052ada6227b26271c6348c83c514b993e965bd/verdict.json",
            "firstSeen": "2026-09-28T16:20:01Z",
            "served": {
              "checked": 2,
              "total": 2,
              "mismatches": 0,
              "lastCheckedAt": "2026-10-01T13:44:20Z"
            },
            "error": null
          }
        ]
      },
      "confidentiality": {
        "level": "ok",
        "checks": [
          {
            "id": "incidents",
            "level": "ok",
            "code": "clear",
            "open": [],
            "error": null
          }
        ]
      }
    }
  }
}
